rank	path	pagerank	in_links	title
1	blog/ai-brand-photography-cost.html	0.047947	33	How Much Does AI Brand Photography Actually Cost in 2026? | LoopWorker
2	blog/how-to-batch-content-creation.html	0.033436	29	How to Batch Content Creation: Produce a Month of Posts in One Day | LoopWorker
3	blog/content-calendar-template-small-business.html	0.033346	28	Free Content Calendar Template for Small Business (2026) | LoopWorker
4	blog/ai-photography-prompts-that-dont-look-ai.html	0.033335	28	50 AI Photography Prompts That Don't Look Like AI | LoopWorker
5	blog/social-media-content-strategy-small-business.html	0.031911	27	Social Media Content Strategy for Small Business: The 2026 Playbook | LoopWorker
6	blog/how-to-automate-instagram-posting.html	0.029522	13	How to Automate Instagram Posting for Your Business in 2026 | LoopWorker
7	blog/how-to-create-brand-style-guide-ai.html	0.027341	28	How to Create a Brand Style Guide with AI in 2026 | LoopWorker
8	blog/build-brand-identity-with-ai.html	0.027213	29	How to Build a Complete Brand Identity Using AI in 7 Days
9	blog/ai-content-automation-small-business.html	0.027041	19	AI Content Automation for Small Business: The Complete 2026 Playbook | LoopWorker
10	blog/ai-vs-traditional-product-photography.html	0.027006	14	AI vs Traditional Product Photography: Which Is Right for Your Brand? | LoopWorker
11	blog/ai-brand-photography-vs-stock-photos.html	0.022465	9	AI Brand Photography vs Stock Photos: Why Generic Images Kill Your Brand | LoopWorker
12	blog/ecommerce-ai-product-photos.html	0.021148	16	AI Product Photography for E-commerce: Cut Your Photo Budget by 80%
13	blog/hiring-photographer-vs-ai-photography.html	0.021044	8	Hiring a Photographer vs AI Photography: The Real Cost & Quality Breakdown | LoopWorker
14	blog/how-to-write-instagram-captions.html	0.017660	18	How to Write Instagram Captions That Actually Convert | LoopWorker
15	blog/local-seo-guide-small-business.html	0.016806	13	Local SEO Guide for Small Business: Rank in Google Maps and Search | LoopWorker
16	blog/build-visual-brand-instagram.html	0.016749	23	How to Build a Visual Brand on Instagram from Scratch (2026) | LoopWorker
17	blog/ai-product-photography-amazon-sellers.html	0.014626	11	AI Product Photography for Amazon Sellers: FBA Image Guide (2026) | LoopWorker
18	blog/restaurant-ai-photography.html	0.014443	12	AI Photography for Restaurants: How to Fill Your Instagram Without a Photographer
19	blog/ai-photography-for-personal-brands.html	0.013876	7	AI Photography for Personal Brands: LinkedIn, Coaching & Authority Content | LoopWorker
20	blog/how-to-write-a-business-bio.html	0.013835	8	How to Write a Business Bio That Actually Works (With Templates) | LoopWorker
21	blog/content-repurposing-strategy.html	0.013323	20	Content Repurposing Strategy: Turn 1 Piece into 10 Without Being Lazy | LoopWorker
22	blog/best-ai-tools-small-business-marketing.html	0.012940	12	Best AI Tools for Small Business Marketing in 2026 | LoopWorker
23	blog/small-business-branding-mistakes.html	0.012242	6	15 Branding Mistakes Small Businesses Make (and How to Fix Them) | LoopWorker
24	blog/how-to-get-more-google-reviews.html	0.012064	39	How to Get More Google Reviews for Your Business (Without Being Annoying) | LoopWorker
25	blog/restaurant-instagram-content-ideas.html	0.011545	51	Restaurant Instagram Content Ideas: 40 Posts That Fill Tables | LoopWorker
26	blog/n8n-vs-zapier-vs-make-automation.html	0.010564	3	n8n vs Zapier vs Make: Best Automation Tool for Content Marketing in 2026 | LoopWorker
27	blog/google-business-profile-optimization.html	0.010192	30	Google Business Profile Optimization: The Free Marketing Channel You're Ignoring | LoopWorker
28	blog/ai-generated-lifestyle-photography.html	0.010044	7	AI-Generated Lifestyle Photography: The Brand Content Shortcut Nobody's Talking About | LoopWorker
29	blog/ai-headshots-for-business.html	0.009188	15	AI Headshots for Business: Better Than Studio Photos in 2026? | LoopWorker
30	blog/how-to-increase-instagram-engagement.html	0.009087	24	How to Increase Instagram Engagement in 2026: What Actually Works | LoopWorker
31	blog/instagram-reel-ideas-small-business.html	0.009079	30	30 Instagram Reel Ideas for Small Business (Film These Today) | LoopWorker
32	blog/yelp-optimization-guide.html	0.008683	6	Yelp Optimization Guide: Complete Profile Setup and Strategy | LoopWorker
33	blog/instagram-carousel-strategy.html	0.008556	16	Instagram Carousel Strategy: How to Get 3x More Saves and Shares | LoopWorker
34	blog/midjourney-vs-chatgpt-brand-photography.html	0.008539	4	Midjourney vs ChatGPT for Brand Photography: Which AI Makes Better Images? | LoopWorker
35	blog/how-to-get-clients-on-instagram.html	0.008145	18	How to Get Clients on Instagram: A Small Business Guide | LoopWorker
36	blog/how-to-create-a-portfolio-website.html	0.008027	6	How to Create a Portfolio Website That Gets Clients (2026 Guide) | LoopWorker
37	blog/diy-branding-vs-hiring-agency.html	0.007825	7	DIY Branding vs Hiring an Agency: The Honest Truth for Small Business | LoopWorker
38	blog/ai-photography-for-food-brands.html	0.007272	5	AI Photography for Food Brands: Menu Shots, Social Content, and Packaging Imagery | LoopWorker
39	blog/small-business-photography-checklist.html	0.007264	6	The 50-Shot Photography Checklist Every Small Business Needs | LoopWorker
40	blog/food-photography-tips-phone.html	0.007197	35	Food Photography Tips with Your Phone: Settings, Angles, and Editing | LoopWorker
41	blog/brand-photography-for-small-business.html	0.007061	15	Brand Photography for Small Business: The 2026 Guide (Traditional + AI) | LoopWorker
42	blog/ai-copywriting-tools-small-business.html	0.006964	5	AI Copywriting Tools for Small Business: ChatGPT, Jasper, Copy.ai, Claude Compared | LoopWorker
43	blog/google-ads-for-small-business-beginners.html	0.006554	4	Google Ads for Small Business: The Beginner's Setup Guide | LoopWorker
44	blog/social-media-manager-vs-ai-automation.html	0.006553	4	Hiring a Social Media Manager vs AI Automation: What Actually Gets Results? | LoopWorker
45	blog/social-media-scheduling-tools-compared.html	0.005885	6	8 Social Media Scheduling Tools Compared for Small Business (2026) | LoopWorker
46	blog/ai-marketing-for-local-business.html	0.005829	7	AI Marketing for Local Business: Compete with Big Brands on a Small Budget | LoopWorker
47	blog/how-to-take-product-photos-with-phone.html	0.005757	14	How to Take Product Photos with Your Phone (And When AI Is Better) | LoopWorker
48	blog/lighting-setup-product-photography-diy.html	0.005659	13	DIY Lighting Setup for Product Photography: $20 vs $200 vs $2000 | LoopWorker
49	blog/ai-photography-for-fashion-brands.html	0.005130	2	AI Photography for Fashion Brands: Lookbooks, Flat Lays, and Campaign Imagery | LoopWorker
50	blog/linkedin-content-strategy-small-business.html	0.004789	7	LinkedIn Content Strategy for Small Business Owners: Get Clients, Not Just Likes | LoopWorker
51	blog/how-to-price-creative-services.html	0.004507	6	How to Price Creative Services in 2026: Stop Undercharging | LoopWorker
52	blog/flat-lay-photography-guide.html	0.004471	10	Flat Lay Photography Guide: Composition Rules, Props, and Editing | LoopWorker
53	blog/iphone-photography-settings-product-photos.html	0.004356	8	iPhone Photography Settings for Product Photos: The Exact Setup | LoopWorker
54	blog/customer-referral-program-ideas.html	0.004283	6	12 Customer Referral Program Ideas for Service Businesses | LoopWorker
55	blog/shopify-store-photography-guide.html	0.004271	5	Shopify Store Photography Guide: The 7 Images Every Listing Needs | LoopWorker
56	blog/med-spa-before-after-photos.html	0.004237	4	How to Take Before and After Photos That Build Trust (Med Spa Guide) | LoopWorker
57	blog/med-spa-instagram-content-ideas.html	0.004237	4	25 Instagram Content Ideas for Med Spas That Actually Drive Bookings | LoopWorker
58	blog/med-spa-marketing-ideas.html	0.004237	3	15 Med Spa Marketing Ideas That Actually Bring in New Clients | LoopWorker
59	blog/med-spa-social-media-strategy.html	0.004237	4	Med Spa Social Media Strategy: How to Get More Clients in 2026 | LoopWorker
60	blog/email-marketing-for-small-business.html	0.004225	13	Email Marketing for Small Business: The 2026 Setup Guide (With AI) | LoopWorker
61	blog/facebook-ads-small-business-guide.html	0.004080	4	Facebook Ads for Small Business: Campaign Structure to Scaling | LoopWorker
62	blog/website-vs-social-media-small-business.html	0.004074	3	Website vs Social Media: Does Your Small Business Actually Need a Website in 2026? | LoopWorker
63	blog/influencer-marketing-small-business.html	0.003771	5	Influencer Marketing for Small Business: Find, Pitch, and Measure ROI | LoopWorker
64	blog/social-media-post-ideas-small-business.html	0.003659	8	50 Social Media Post Ideas for Small Business (Never Run Out of Content) | LoopWorker
65	blog/how-to-write-product-descriptions.html	0.003508	3	How to Write Product Descriptions That Actually Sell | LoopWorker
66	blog/amazon-listing-optimization-guide.html	0.003411	3	Amazon Listing Optimization Guide: Title Formulas, Images, and A+ Content | LoopWorker
67	blog/tiktok-marketing-small-business-guide.html	0.003337	4	TikTok Marketing for Small Business: The Complete Guide | LoopWorker
68	blog/social-media-manager-for-restaurants.html	0.003183	4	Do You Need a Social Media Manager for Your Restaurant? (Honest Answer) | LoopWorker
69	blog/how-to-create-lead-magnet-small-business.html	0.003062	8	How to Create a Lead Magnet That Actually Converts (Small Business Guide) | LoopWorker
70	blog/how-to-run-a-giveaway-instagram.html	0.003056	4	How to Run an Instagram Giveaway That Actually Grows Your Following | LoopWorker
71	blog/content-creation-packages-small-business.html	0.002997	4	Social Media Content Creation Packages: What's Included and What to Pay in 2026 | LoopWorker
72	blog/done-for-you-social-media-content.html	0.002997	4	Done-For-You Social Media Content: What It Is, What It Costs, and Who It's For | LoopWorker
73	blog/hire-social-media-content-creator.html	0.002997	4	How to Hire a Social Media Content Creator for Your Business (2026 Guide) | LoopWorker
74	blog/outsource-social-media-small-business.html	0.002997	4	Should You Outsource Your Social Media? A Small Business Owner's Guide | LoopWorker
75	blog/how-to-build-a-brand-from-scratch.html	0.002702	10	How to Build a Brand from Scratch: The 2026 Startup Guide | LoopWorker
76	blog/how-to-grow-instagram-followers-organically.html	0.002627	6	How to Grow Instagram Followers Organically in 2026 (No Bots, No Ads) | LoopWorker
77	blog/start-content-creation-business-with-ai.html	0.002616	4	How to Start a Content Creation Business with AI in 2026 | LoopWorker
78	blog/ai-photo-enhancement-iphone.html	0.002343	3	How to Turn iPhone Photos Into Professional Content with AI | LoopWorker
79	blog/salon-marketing-ideas.html	0.002329	10	Salon Marketing Ideas That Actually Work: 25 Strategies (Most Are Free) | LoopWorker
80	blog/ecommerce-product-launch-checklist.html	0.002268	3	E-commerce Product Launch Checklist: 30 Steps from Photos to First Sale | LoopWorker
81	blog/ugc-content-guide-small-business.html	0.002230	9	UGC Content Guide for Small Business: How to Get (and Use) Customer Photos | LoopWorker
82	blog/restaurant-social-media-strategy.html	0.002164	7	Restaurant Social Media Strategy: The Complete 2026 Playbook | LoopWorker
83	blog/restaurant-menu-photography.html	0.002109	7	How to Photograph Every Menu Item: The Complete Restaurant Menu Photography Guide | LoopWorker
84	blog/ai-photography-prompt-formulas.html	0.002068	3	AI Photography Prompt Formulas: 10 Templates That Work Every Time | LoopWorker
85	blog/ai-photography-for-salons-barbershops.html	0.002065	6	AI Photography for Salons and Barbershops: Marketing Visuals That Book Clients | LoopWorker
86	blog/ai-video-production-for-brands.html	0.002010	2	AI Video Production for Brands: Reels, Promos & Product Demos in Minutes
87	blog/small-business-seo-checklist.html	0.001999	9	Small Business SEO Checklist: 40 Things to Fix Today (Free) | LoopWorker
88	blog/bright-airy-food-photography.html	0.001948	8	Bright and Airy Food Photography: Natural Light, Backgrounds, and Editing Guide | LoopWorker
89	blog/dark-moody-food-photography.html	0.001948	8	Dark and Moody Food Photography: Lighting, Settings, and Editing Guide | LoopWorker
90	blog/linkedin-personal-brand-guide.html	0.001946	2	LinkedIn Personal Brand Guide: Profile Optimization, Content Strategy, and How do you convert LinkedIn connections into clients? | LoopWorker
91	blog/personal-brand-content-plan.html	0.001946	2	Personal Brand Content Plan: The 90-Day System for Coaches and Consultants | LoopWorker
92	blog/email-subject-lines-small-business.html	0.001846	6	75 Email Subject Lines That Actually Get Opened (By Category) | LoopWorker
93	blog/instagram-vs-tiktok-small-business.html	0.001844	6	Instagram vs TikTok for Small Business: Where Should You Post in 2026? | LoopWorker
94	blog/how-to-get-testimonials-from-clients.html	0.001790	5	How to Get Testimonials from Clients (Without Being Awkward) | LoopWorker
95	blog/ai-tools-for-photographers.html	0.001789	5	AI Tools for Photographers: Enhance Your Workflow, Not Replace It | LoopWorker
96	blog/climbing-gym-marketing.html	0.001753	4	Climbing Gym Marketing: How to Attract New Climbers and Build Community | LoopWorker
97	blog/fitness-studio-instagram-strategy.html	0.001753	3	Instagram Strategy for Fitness Studios: What Actually Gets New Members | LoopWorker
98	blog/gym-instagram-content-ideas.html	0.001753	5	20 Instagram Content Ideas for Gyms That Drive Memberships | LoopWorker
99	blog/gym-social-media-strategy.html	0.001753	4	Gym Social Media Strategy: How to Get More Members in 2026 | LoopWorker
100	blog/how-much-does-social-media-management-cost.html	0.001747	4	How Much Does Social Media Management Cost in 2026? (Real Numbers) | LoopWorker
101	blog/social-media-help-for-small-business.html	0.001747	4	I Need Help With My Social Media: A Small Business Owner's Playbook | LoopWorker
102	blog/ai-background-removal-product-photos.html	0.001678	3	AI Background Removal for Product Photos: Free Tools and Best Practices | LoopWorker
103	blog/ai-photography-for-gyms-fitness.html	0.001676	6	AI Photography for Gyms & Fitness Brands: Facility, Lifestyle, and Social Content | LoopWorker
104	blog/brand-color-palette-guide.html	0.001653	7	How to Create a Brand Color Palette: The Complete Guide (With Free Tools) | LoopWorker
105	blog/before-after-content-small-business.html	0.001626	8	Before &amp; After Content for Small Business: The Format That Gets Saves | LoopWorker
106	blog/coffee-shop-branding-guide.html	0.001610	8	Coffee Shop Branding Guide: How to Look Like a $2M Brand on a $200 Budget | LoopWorker
107	blog/ai-photography-for-coaches-consultants.html	0.001549	3	AI Photography for Coaches & Consultants: Build Authority Without a Photoshoot | LoopWorker
108	blog/local-business-instagram-growth.html	0.001433	5	How to Grow Your Local Business on Instagram (No Gimmicks, Just What Works) | LoopWorker
109	blog/best-social-media-service-for-local-business.html	0.001378	2	Best Social Media Services for Local Businesses in 2026 (Compared) | LoopWorker
110	blog/canva-vs-custom-brand-design.html	0.001369	6	Canva vs Custom Brand Design: Which Actually Builds a Real Brand? | LoopWorker
111	blog/ai-photography-real-estate-listings.html	0.001368	7	AI Photography for Real Estate Listings: The Complete 2026 Guide | LoopWorker
112	blog/etsy-seo-guide-2026.html	0.001360	2	Etsy SEO Guide 2026: Tags, Titles, Long-Tail Keywords, and Etsy Ads | LoopWorker
113	blog/phone-photography-lighting-hacks.html	0.001353	4	Phone Photography Lighting Hacks: 10 Setups Using Things You Already Own | LoopWorker
114	blog/smartphone-food-photography-mistakes.html	0.001353	4	12 Smartphone Food Photography Mistakes and How to Fix Each One | LoopWorker
115	blog/social-media-not-working-small-business.html	0.001300	2	Why Your Social Media Isn't Working (And What to Do About It) | LoopWorker
116	blog/ai-photography-for-interior-designers.html	0.001271	3	AI Photography for Interior Designers: Portfolio, Social, and Client Presentations | LoopWorker
117	blog/ai-photography-for-wedding-vendors.html	0.001271	3	AI Photography for Wedding Vendors: Venues, Planners, Florists, and Caterers | LoopWorker
118	blog/small-business-social-media-mistakes.html	0.001210	3	11 Social Media Mistakes Small Businesses Make (And What to Do Instead) | LoopWorker
119	blog/headshot-tips-small-business.html	0.001184	3	Professional Headshots on a Budget: DIY, AI, and When to Hire | LoopWorker
120	blog/call-to-action-examples.html	0.001175	6	50 Call-to-Action Examples That Actually Convert (By Platform) | LoopWorker
121	blog/ai-photography-for-med-spas.html	0.001136	2	AI Photography for Med Spas and Aesthetic Clinics | LoopWorker
122	blog/branding-checklist-small-business.html	0.001122	3	The Complete Branding Checklist for Small Business (Free Download) | LoopWorker
123	blog/fiverr-vs-professional-brand-design.html	0.001114	2	Fiverr vs Professional Brand Design: Why Cheap Logos Cost You More | LoopWorker
124	blog/iphone-portrait-mode-business.html	0.001101	3	iPhone Portrait Mode for Business: Team Headshots, Product Shots, and Lifestyle Photos | LoopWorker
125	blog/free-ai-prompts-for-small-business.html	0.001075	2	100 Free AI Prompts for Small Business Marketing (Copy & Paste) | LoopWorker
126	blog/food-photography-props-guide.html	0.001050	2	Food Photography Props: The Complete Shopping List with Budget Options | LoopWorker
127	blog/food-styling-tips-beginners.html	0.001041	4	Food Styling Tips for Beginners: Make Any Dish Look Instagram-Ready | LoopWorker
128	blog/pinterest-marketing-small-business.html	0.001041	4	Pinterest Marketing for Small Business: The Untapped Traffic Source | LoopWorker
129	blog/ai-photography-for-dental-practices.html	0.001026	4	AI Photography for Dental Practices: Before/After, Team Photos, and Social Content | LoopWorker
130	blog/restaurant-social-media-manager-cost.html	0.001007	1	How Much Should a Restaurant Pay for Social Media Help? (2026 Pricing) | LoopWorker
131	blog/small-business-marketing-budget.html	0.001007	2	Small Business Marketing Budget: How to Allocate Every Dollar in 2026 | LoopWorker
132	blog/landing-page-copywriting-guide.html	0.000996	3	Landing Page Copywriting Guide: Above the Fold, CTAs, and 3 Complete Templates | LoopWorker
133	blog/restaurant-google-business-profile.html	0.000971	3	Restaurant Google Business Profile: The Setup That Gets You Found | LoopWorker
134	blog/how-to-create-social-media-graphics.html	0.000969	3	How to Create Social Media Graphics That Stop the Scroll | LoopWorker
135	blog/restaurant-user-generated-content.html	0.000949	3	Restaurant User-Generated Content: Getting Customers to Create Content for You | LoopWorker
136	blog/restaurant-video-content-guide.html	0.000949	3	Restaurant Video Content Guide: Sizzle Reels, Kitchen Tours, and Posting Strategy | LoopWorker
137	blog/restaurant-seasonal-marketing.html	0.000934	3	Restaurant Seasonal Marketing: Content Calendar and Promotion Ideas for Every Month | LoopWorker
138	blog/social-media-image-sizes-2026.html	0.000934	3	Social Media Image Sizes Cheat Sheet 2026: Every Platform, Every Format | LoopWorker
139	blog/ai-photography-for-etsy-sellers.html	0.000925	2	AI Photography for Etsy Sellers: Listings That Actually Sell | LoopWorker
140	blog/edit-photos-on-phone-workflow.html	0.000923	2	Edit Photos on Phone: Complete Workflow from Shoot to Post | LoopWorker
141	blog/website-copywriting-templates.html	0.000906	3	Website Copywriting Templates: Every Page, Every Section (Copy-Paste) | LoopWorker
142	blog/email-welcome-sequence-templates.html	0.000847	2	Email Welcome Sequence Templates: 5 Emails That Convert New Subscribers | LoopWorker
143	blog/social-proof-strategies-small-business.html	0.000847	2	Social Proof Strategies for Small Business: Testimonials, Reviews, and Trust Signals | LoopWorker
144	blog/food-influencer-collaboration-guide.html	0.000837	2	Food Influencer Collaboration Guide: How Restaurants Find, Vet, and Measure Results | LoopWorker
145	blog/instagram-hashtag-strategy-2026.html	0.000837	2	Instagram Hashtag Strategy 2026: The Research Method + 200 Hashtags by Industry | LoopWorker
146	blog/iphone-video-settings-social-media.html	0.000837	2	iPhone Video Settings for Social Media: Exact Settings for Reels, TikTok, and YouTube Shorts | LoopWorker
147	blog/business-description-templates.html	0.000828	2	How to Write a Business Description: Templates for Every Platform | LoopWorker
148	blog/how-to-rebrand-your-small-business.html	0.000826	2	How to Rebrand Your Small Business Without Starting Over | LoopWorker
149	blog/spa-social-media-strategy.html	0.000816	1	Spa Social Media Strategy: How to Fill Your Appointment Book From Instagram | LoopWorker
150	blog/instagram-bio-ideas-small-business.html	0.000812	2	Instagram Bio Ideas for Small Business: 40+ Copy-Paste Templates | LoopWorker
151	blog/client-onboarding-checklist.html	0.000807	2	Client Onboarding Checklist for Service Businesses: 25 Steps That Build Trust | LoopWorker
152	blog/client-retention-strategies.html	0.000807	2	15 Client Retention Strategies for Service Businesses | LoopWorker
153	blog/how-to-start-a-service-business.html	0.000807	2	How to Start a Service Business: From Idea to First 10 Clients | LoopWorker
154	blog/ai-image-upscaling-guide.html	0.000771	2	AI Image Upscaling Guide: Make Low-Res Photos Print and Web Ready | LoopWorker
155	blog/ai-photography-for-pet-businesses.html	0.000771	2	AI Photography for Pet Businesses: Groomers, Vets, and Pet Brands | LoopWorker
156	blog/cafe-marketing-ideas.html	0.000771	2	Cafe Marketing Ideas: 20 Low-Cost Strategies That Build Regulars | LoopWorker
157	blog/ecommerce-instagram-strategy.html	0.000771	3	E-commerce Instagram Strategy: Turn Followers into Buyers | LoopWorker
158	blog/food-delivery-app-optimization.html	0.000771	2	Food Delivery App Optimization: Get More Orders on DoorDash, Uber Eats, and Grubhub | LoopWorker
159	blog/food-truck-marketing-guide.html	0.000771	2	Food Truck Marketing Guide: Build a Following Before You Park | LoopWorker
160	blog/hotel-marketing-content-strategy.html	0.000771	2	Hotel Marketing Content Strategy: Fill Rooms with Content, Not Just Ads | LoopWorker
161	blog/real-estate-social-media-guide.html	0.000771	2	Real Estate Social Media Guide: Content That Generates Leads (Not Just Likes) | LoopWorker
162	blog/restaurant-event-marketing.html	0.000771	3	Restaurant Event Marketing: Host Events That Fill Your Space (And Social Feed) | LoopWorker
163	blog/restaurant-review-management.html	0.000771	2	Restaurant Review Management: How to Get 5-Star Reviews (And Handle Bad Ones) | LoopWorker
164	blog/ai-photography-for-chiropractors.html	0.000636	1	AI Photography for Chiropractors: Marketing Visuals That Attract Patients | LoopWorker
165	blog/ai-photography-for-lawyers.html	0.000636	1	AI Photography for Law Firms: Professional Visuals That Build Trust | LoopWorker
166	blog/ai-tools-for-restaurant-owners.html	0.000636	1	AI Tools for Restaurant Owners: Menu Optimization, Review Response, Social Media Content, and More | LoopWorker
167	blog/auto-detailing-marketing.html	0.000636	1	Auto Detailing Marketing: Before &amp; After Content That Books Jobs | LoopWorker
168	blog/bakery-instagram-content-ideas.html	0.000636	1	Bakery Instagram Content Ideas: 35 Posts That Sell Out Your Display Case | LoopWorker
169	blog/bar-nightclub-marketing.html	0.000636	1	Bar and Nightclub Marketing: Cocktail Photography, Event Promotion, and Social Strategy | LoopWorker
170	blog/barbershop-social-media-guide.html	0.000636	0	Barbershop Social Media Guide: Get Booked Out With Instagram | LoopWorker
171	blog/bbq-restaurant-marketing.html	0.000636	1	BBQ Restaurant Marketing: Smoke Photography, Pitmaster Content, and Competition Strategy | LoopWorker
172	blog/boutique-hotel-instagram.html	0.000636	2	Boutique Hotel Instagram Strategy: Stand Out from the Big Chains | LoopWorker
173	blog/brand-name-generator-tips.html	0.000636	1	How to Name Your Business: 7 Naming Formulas + 100 Examples | LoopWorker
174	blog/brunch-restaurant-marketing.html	0.000636	1	Brunch Restaurant Marketing: The Complete Guide to the Brunch Aesthetic | LoopWorker
175	blog/canva-templates-small-business.html	0.000636	1	How to Use Canva for Small Business: 15 Templates You Need (Free) | LoopWorker
176	blog/catering-business-marketing.html	0.000636	1	Catering Business Marketing: Corporate Outreach, Tasting Events, Portfolio Photography, and Pricing | LoopWorker
177	blog/chiropractor-marketing-ideas.html	0.000636	0	Chiropractor Marketing: 12 Ideas to Get More Patients Without Ads | LoopWorker
178	blog/cleaning-business-marketing.html	0.000636	1	Cleaning Business Marketing: Get Clients Without Paying for Leads | LoopWorker
179	blog/cocktail-photography-guide.html	0.000636	1	Cocktail Photography Guide: Make Your Drinks Look as Good as They Taste | LoopWorker
180	blog/coffee-shop-social-media-guide.html	0.000636	0	Coffee Shop Social Media Guide: Build a Local Following That Actually Visits | LoopWorker
181	blog/content-calendar-generator.html	0.000636	1	Free Content Calendar Generator — Build Your Month in 60 Seconds | LoopWorker
182	blog/content-creation-setup-home.html	0.000636	1	Home Content Creation Setup for Small Business Owners: $50 to $500 | LoopWorker
183	blog/contractor-marketing-ideas.html	0.000636	1	Contractor Marketing Ideas: Get Jobs Without Paying for Leads | LoopWorker
184	blog/dental-practice-marketing.html	0.000636	1	Dental Practice Marketing: 20 Strategies That Fill Your Schedule | LoopWorker
185	blog/dropshipping-product-photography.html	0.000636	1	Dropshipping Product Photography: Get Great Photos Without the Product | LoopWorker
186	blog/fitness-trainer-content-strategy.html	0.000636	1	Fitness Trainer Content Strategy: Get Clients from Social Media | LoopWorker
