rank	path	pagerank	in_links	title
187	blog/florist-marketing-ideas.html	0.000636	1	Florist Marketing Ideas: 20 Ways to Fill Your Order Book | LoopWorker
188	blog/food-photography-editing-lightroom.html	0.000636	1	Food Photography Editing in Lightroom: Complete Tutorial with Slider Values | LoopWorker
189	blog/food-truck-instagram-content.html	0.000636	1	30 Instagram Content Ideas for Food Trucks: Location Posts, Menu Reveals, and More | LoopWorker
190	blog/google-business-profile-posts.html	0.000636	1	Google Business Profile Posts: Post Types, Photo Strategy, Q&amp;A Management, and Performance Tracking | LoopWorker
191	blog/gym-marketing-strategies.html	0.000636	1	Gym Marketing Strategies That Fill Memberships: 20 Ideas (With Templates) | LoopWorker
192	blog/gym-member-retention-strategies.html	0.000636	0	Gym Member Retention: 12 Strategies That Actually Keep People Coming Back | LoopWorker
193	blog/how-to-create-a-media-kit.html	0.000636	1	How to Create a Media Kit: What to Include, Templates, and Free Tools | LoopWorker
194	blog/how-to-get-more-clients-as-a-hairstylist.html	0.000636	0	How to Get More Clients as a Hairstylist (Without Paid Ads) | LoopWorker
195	blog/how-to-get-more-restaurant-customers.html	0.000636	0	How to Get More Restaurant Customers in 2026 (15 Proven Strategies) | LoopWorker
196	blog/how-to-get-press-coverage.html	0.000636	1	How to Get Press Coverage for Your Small Business: Templates, Journalist Outreach, and Building a Press Page | LoopWorker
197	blog/ice-cream-shop-marketing.html	0.000636	1	Ice Cream Shop Marketing: Seasonal Strategy, Flavor Launches, and the Instagram Wall | LoopWorker
198	blog/instagram-story-ideas-small-business.html	0.000636	1	Instagram Story Ideas for Small Business: 30 Templates That Drive DMs | LoopWorker
199	blog/interior-photography-phone.html	0.000636	1	Interior Photography with Your Phone: Settings for Restaurants, Salons, and Retail | LoopWorker
200	blog/iphone-food-photography-restaurant.html	0.000636	1	iPhone Food Photography for Restaurants: The 10-Minute Daily System | LoopWorker
201	blog/landscaping-marketing-guide.html	0.000636	1	Landscaping Marketing Guide: Get More Jobs from Your Phone | LoopWorker
202	blog/lightroom-mobile-presets-small-business.html	0.000636	1	Lightroom Mobile Presets for Small Business: Create Your Brand Look in 5 Minutes | LoopWorker
203	blog/meal-prep-business-marketing.html	0.000636	1	Meal Prep Business Marketing: Subscription Content, Macro Photography, Packaging Shots, and Delivery Day | LoopWorker
204	blog/medspa-client-retention-strategies.html	0.000636	0	Med Spa Client Retention: 10 Ways to Keep Clients Coming Back | LoopWorker
205	blog/menu-design-tips-restaurants.html	0.000636	1	Menu Design Tips: Psychology, Layout, and Pricing That Increase Revenue | LoopWorker
206	blog/nail-salon-instagram-ideas.html	0.000636	0	Nail Salon Instagram Ideas: 20 Posts That Actually Get You Booked | LoopWorker
207	blog/pet-grooming-marketing.html	0.000636	1	Pet Grooming Marketing: Turn Cute Dogs Into a Content Machine | LoopWorker
208	blog/photo-editing-apps-small-business.html	0.000636	1	Best Photo Editing Apps for Small Business: Free and Paid (2026) | LoopWorker
209	blog/pizza-shop-marketing-guide.html	0.000636	1	Pizza Shop Marketing Guide: The Complete Playbook for Pizza Restaurants | LoopWorker
210	blog/pricing-page-design-guide.html	0.000636	1	How to Design a Pricing Page That Converts: Layout, Psychology, and Examples | LoopWorker
211	blog/product-photography-white-background.html	0.000636	1	Product Photography on White Background: DIY Setup for $15 | LoopWorker
212	blog/real-estate-instagram-strategy.html	0.000636	2	Instagram Strategy for Real Estate Agents: Get Clients Without Cold Calling | LoopWorker
213	blog/restaurant-branding-guide.html	0.000636	1	Restaurant Branding Guide: Look Like a $2M Restaurant on Any Budget | LoopWorker
214	blog/restaurant-catering-marketing.html	0.000636	1	Restaurant Catering Marketing: Add a Revenue Stream Without Adding Staff | LoopWorker
215	blog/restaurant-email-marketing.html	0.000636	1	Restaurant Email Marketing: Build a List That Fills Slow Nights | LoopWorker
216	blog/restaurant-grand-opening-marketing.html	0.000636	1	Restaurant Grand Opening Marketing: The 30-Day Launch Plan | LoopWorker
217	blog/restaurant-instagram-aesthetic.html	0.000636	1	Restaurant Instagram Aesthetic: Grid Planning, Color Consistency, and Maintaining Visual Brand | LoopWorker
218	blog/restaurant-instagram-reels-ideas.html	0.000636	1	Restaurant Instagram Reels: 20 Ideas That Get Views (With Hooks) | LoopWorker
219	blog/restaurant-loyalty-program.html	0.000636	1	Restaurant Loyalty Program: Build One That Actually Works | LoopWorker
220	blog/restaurant-partnership-marketing.html	0.000636	1	Restaurant Partnership Marketing: Cross-Promote with Local Businesses | LoopWorker
221	blog/restaurant-photography-on-budget.html	0.000636	1	Restaurant Photography on a Budget: Pro Results Without Pro Prices | LoopWorker
222	blog/restaurant-photography-shot-list.html	0.000636	1	Restaurant Photography Shot List: 25 Photos Every Restaurant Needs | LoopWorker
223	blog/restaurant-social-media-mistakes.html	0.000636	1	Restaurant Social Media Mistakes: 15 Things Killing Your Engagement | LoopWorker
224	blog/restaurant-staff-as-content-creators.html	0.000636	1	Turn Your Restaurant Staff Into Content Creators (Without the Cringe) | LoopWorker
225	blog/restaurant-website-essentials.html	0.000636	1	Restaurant Website Essentials: What to Include (And What to Skip) | LoopWorker
226	blog/salon-instagram-strategy.html	0.000636	0	Instagram Strategy for Salons: How to Turn Followers into Bookings | LoopWorker
227	blog/social-media-analytics-guide.html	0.000636	1	Social Media Analytics for Small Business: What to Track (And What to Ignore) | LoopWorker
228	blog/sushi-restaurant-marketing.html	0.000636	1	Sushi Restaurant Marketing: Omakase Content, Chef Videos, and Minimalist Food Photography | LoopWorker
229	blog/tattoo-shop-marketing.html	0.000636	1	Tattoo Shop Marketing: Build a Waitlist Through Content | LoopWorker
230	blog/threads-marketing-guide.html	0.000636	1	Threads Marketing Guide: Algorithm, Content Strategy, and Growth Tactics for Small Business | LoopWorker
231	blog/tiktok-for-restaurants.html	0.000636	1	TikTok for Restaurants: How to Go Viral (And Actually Get Customers) | LoopWorker
232	blog/vegan-restaurant-marketing.html	0.000636	1	Vegan Restaurant Marketing: Plant-Based Photography, Values-Driven Content, and Community Building | LoopWorker
233	blog/video-content-ideas-small-business.html	0.000636	1	Video Content Ideas for Small Business: 25 Videos You Can Film Today | LoopWorker
234	blog/wedding-vendor-content-strategy.html	0.000636	1	Wedding Vendor Content Strategy: Get Booked Year-Round | LoopWorker
235	blog/yoga-studio-marketing.html	0.000636	1	Yoga Studio Marketing: Fill Your Classes Without Discounting | LoopWorker
236	blog/youtube-shorts-small-business.html	0.000636	1	YouTube Shorts for Small Business: Settings, Hashtags, Monetization, and the Long-Tail SEO Advantage | LoopWorker
